{
  "$schema": "https://json-schema.org/draft/2020-12/schema",
  "$id": "urn:aaas:events:envelope:v1",
  "$comment": "Component: contracts. Owning Team: Platform Enablement Guild (PEG). Classification: INTERNAL. Related Docs: CLAUDE.md 4.2, ADR-0013, contracts/events/README.md.",
  "title": "aaas.envelope.v1",
  "description": "Envelope shared by every event published on Redpanda: identity, type and version, time, producing service, task, trace context and the type-specific payload. Event schemas reference it and narrow type, version, producer, taskId and payload.",
  "type": "object",
  "required": ["eventId", "type", "version", "occurredAt", "producer", "taskId", "traceparent", "payload"],
  "additionalProperties": false,
  "properties": {
    "eventId": {
      "description": "Unique identifier of this event, a lowercase UUIDv7 (RFC 9562) generated by the producer. Consumers deduplicate on it (table processed_events, CLAUDE.md 4.2).",
      "$ref": "#/$defs/uuidV7"
    },
    "type": {
      "description": "Event type: the topic name without the version suffix, `aaas.<entity>.<past-tense-verb>` (for the dead-letter topic: `aaas.dlq`).",
      "type": "string",
      "pattern": "^aaas(\\.[a-z][a-z0-9]*(-[a-z0-9]+)*){1,2}$"
    },
    "version": {
      "description": "Major version of the event; the topic is `<type>.v<version>`.",
      "type": "integer",
      "minimum": 1
    },
    "occurredAt": {
      "description": "Instant the event happened, in UTC with millisecond precision (`YYYY-MM-DDTHH:MM:SS.sssZ`).",
      "$ref": "#/$defs/timestamp"
    },
    "producer": {
      "description": "Name of the producing service (CLAUDE.md section 2, kebab-case).",
      "type": "string",
      "pattern": "^[a-z][a-z0-9]*(-[a-z0-9]+)*$"
    },
    "taskId": {
      "description": "Addition task the event belongs to (UUIDv7, the message key), or null for an event that precedes the creation of a task (aaas.key.pressed.v1, keyed by session instead).",
      "oneOf": [{ "$ref": "#/$defs/uuidV7" }, { "type": "null" }]
    },
    "traceparent": {
      "description": "W3C Trace Context `traceparent` of the span that produced the event (version 00); the trace and parent identifiers must not be all zeros.",
      "type": "string",
      "pattern": "^00-[0-9a-f]{32}-[0-9a-f]{16}-[0-9a-f]{2}$",
      "not": {
        "anyOf": [{ "pattern": "^00-0{32}-" }, { "pattern": "^00-[0-9a-f]{32}-0{16}-" }]
      }
    },
    "payload": {
      "description": "Type-specific content, defined by the schema of each event.",
      "type": "object"
    }
  },
  "$defs": {
    "uuid": {
      "description": "Lowercase UUID of any version (RFC 9562, canonical textual form).",
      "type": "string",
      "pattern": "^[0-9a-f]{8}-[0-9a-f]{4}-[0-9a-f]{4}-[0-9a-f]{4}-[0-9a-f]{12}$"
    },
    "uuidV7": {
      "description": "Lowercase UUID version 7 with the RFC 9562 variant: time-ordered, so identifiers sort by creation time.",
      "type": "string",
      "pattern": "^[0-9a-f]{8}-[0-9a-f]{4}-7[0-9a-f]{3}-[89ab][0-9a-f]{3}-[0-9a-f]{12}$"
    },
    "timestamp": {
      "description": "UTC instant with exactly three fractional digits and the `Z` designator; the fixed form keeps hashes over timestamps reproducible.",
      "type": "string",
      "format": "date-time",
      "pattern": "^[0-9]{4}-[0-9]{2}-[0-9]{2}T[0-9]{2}:[0-9]{2}:[0-9]{2}\\.[0-9]{3}Z$"
    },
    "operand": {
      "description": "Operand of an addition: a non-negative integer in the supported range 0 to 99 999 (CLAUDE.md section 1).",
      "type": "integer",
      "minimum": 0,
      "maximum": 99999
    },
    "sum": {
      "description": "Result of an addition of two operands: a non-negative integer up to 199 998.",
      "type": "integer",
      "minimum": 0,
      "maximum": 199998
    },
    "sha256": {
      "description": "SHA-256 digest as 64 lowercase hexadecimal characters.",
      "type": "string",
      "pattern": "^[0-9a-f]{64}$"
    }
  }
}
