{
  "eventId": "018f3c2e-7b1a-7c3d-9f00-000000000001",
  "type": "aaas.addition.requested",
  "version": 1,
  "occurredAt": "2026-10-16T12:00:00.000Z",
  "producer": "parser",
  "taskId": "018f3c2e-7b1a-7c3d-9f00-0000000000aa",
  "traceparent": "00-4bf92f3577b34da6a3ce929d0e0e4736-00f067aa0ba902b7-01",
  "payload": {
    "a": 3,
    "b": 2
  }
}
