{
  "eventId": "018f3c2e-7b1a-7c3d-9f00-000000000022",
  "type": "aaas.successor.called",
  "version": 1,
  "occurredAt": "2026-10-16T12:00:01.250Z",
  "producer": "successor",
  "taskId": "018f3c2e-7b1a-7c3d-9f00-0000000000aa",
  "traceparent": "00-4bf92f3577b34da6a3ce929d0e0e4736-a1b2c3d4e5f60718-01",
  "payload": {
    "n": 0,
    "result": 1
  }
}
