{
  "eventId": "018f3c2e-7b1a-7c3d-9f00-000000000043",
  "type": "aaas.key.pressed",
  "version": 1,
  "occurredAt": "2026-10-16T11:59:59.950Z",
  "producer": "expression-assembler",
  "taskId": null,
  "traceparent": "00-4bf92f3577b34da6a3ce929d0e0e4736-00f067aa0ba902b7-01",
  "payload": {
    "sessionId": "5b0f8a54-3c1e-4d6f-9a7b-2e8c1d4f6a90",
    "key": "=",
    "seq": 3
  }
}
